,nid,title,department,staff,time,text
0,10000,[國三升學]轉知臺南應用科技大學111學年度大學部七年一貫特色招生甄選入學招生資訊,教務處,註冊組幹事,2021-12-21 11:41:16,臺南應用科技大學111學年度大學部七年一貫特色招生甄選入學招生資訊臺南應用科技大學111學年度大學部七年一貫特色招生甄選入學招生資訊說明：說明：一、招生系別：美術系、音樂系、舞蹈系一、招生系別：美術系、音樂系、舞蹈系二、網路報名時間：111年2月9日至111年3月9日二、網路報名時間：111年2月9日至111年3月9日三、考試時間：111年3月26日三、考試時間：111年3月26日
1,10001,轉知：臺北醫學大學護理學系辦理「護理師體驗營」活動，詳附件。,活動組,活動幹事,2021-12-21 15:11:14,
2,10002,嚴重特殊傳染性肺炎中央流行疫情指揮中心為有效防範COVID-19 Delta 變異株之社區傳播，有關自國外入境之檢疫對象及確定病例之密切接觸者PCR採檢，請依說明段辦理，請查照。,衛生組,學創-衛生,2021-12-21 15:21:17,
3,10003,轉知：國立臺灣師範大學資訊工程學系辦理教育部運算思維推動計畫「高中海狸一日營」，報名截止時間延長至110年12月27日止，詳如附件。,活動組,活動幹事,2021-12-21 15:26:52,
4,10004,轉知：臺北立景美國中辦理「理工女孩站出來-理工生命學科分享與傳承座談」講座，請如說明。,活動組,活動幹事,2021-12-21 16:08:44,
5,10005,轉知：臺北醫學大學辦理勞動部「110年度產業新尖兵試辦計畫」之「國際健康管理行銷企劃人養成班」，詳說明。,活動組,活動幹事,2021-12-21 16:23:24,
6,10006,轉知：「教育部國民及學前教育署第四屆青少年諮詢會之青少年代表報名遴選簡章」，詳說明及附件。,活動組,活動幹事,2021-12-21 16:33:03,
7,10007,轉知-檢送各機關辦理公務人員考績（成）作業要點第21點修正總說明、對照表及修正後全文各1份,人事室,人事助理,2021-12-22 08:25:15,一、依據教育部110年12月14日臺教人(三)字第1100170790號函轉銓敘部110年12月9日部銓三字第11054065132號函辦理，並檢附原函影本1份。一、依據教育部110年12月14日臺教人(三)字第1100170790號函轉銓敘部110年12月9日部銓三字第11054065132號函辦理，並檢附原函影本1份。二、請各校辦理專案考績作業程序及110年度公務人員考績（成）作業相關事宜時，切實依現行公務人員考績法規及旨揭要點辦理。二、請各校辦理專案考績作業程序及110年度公務人員考績（成）作業相關事宜時，切實依現行公務人員考績法規及旨揭要點辦理。
8,10008,轉知-檢送銓敘部修正「各機關辦理公務人員考績(成)作業要點」第21點，並自110年12月9日生效,人事室,人事助理,2021-12-22 08:41:28,一、依教育部110年12月16日臺教人(三)字第1100171808號函轉銓敘部110年12月9日部銓三字第11054065131號令副本辦理，一、依教育部110年12月16日臺教人(三)字第1100171808號函轉銓敘部110年12月9日部銓三字第11054065131號令副本辦理，    並檢附修正令及修正規定影本1份。    並檢附修正令及修正規定影本1份。二、本署業以110年12月21日臺教國署人字第1100169467號函轉旨揭要點修正規定在案，併敘。二、本署業以110年12月21日臺教國署人字第1100169467號函轉旨揭要點修正規定在案，併敘。
9,10009,教育部「學科術語閩客語對譯成果」公開供大眾使用，請參閱。,教務處,實研幹事,2021-12-22 09:42:26,主旨：教育部「學科術語閩客語對譯成果」公開供大眾使用，請詳閱說明及附件。說明：一、為利本土語言沉浸式教學推動，營造校園中母語學習環境，教育部於106年起進行8大領域之學科術語閩南語及客家語編譯，         業完成編譯成果提供教學者及大眾參考運用，以利教學者進行跨學科教學。二、旨揭成果已公告於教育部語文成果網(https://language.moe.gov.tw/001/Upload/FILES/SITE_CONTENT/M0001/subject_mk/subjectterm.pdf)，         敬請協助推廣運用。三、檢附教育部公文1份供參。
10,10010,110學年度新住民語文遠距教學師資培訓課程(臺中場)資訊一案，請參閱。,教務處,實研幹事,2021-12-22 09:44:14,主旨：110學年度新住民語文遠距教學師資培訓課程(臺中場)資訊一案，請詳閱說明。說明：一、請貴校推薦及鼓勵優秀新住民教學支援人員報名本培訓課程。二、報名方式為即日起至111年1月5日(星期三)中午12時前填寫報名表單(https://forms.gle/p6aiTLwkJcFj2jQ78)完成報名。三、針對本案若有相關疑義，請逕洽財團法人商業研究院(商研院)陳小姐，電話02-7707-4965；蔡先生，電話02-7707-4964。
11,10011,110-1第16週整潔競賽成績,衛生組,學創-衛生,2021-12-22 10:24:13,"110-1第16週整潔競賽成績 國中部 國一   第一名 701    701    第二名705 國二     第一名 801    801    第二名804 國三     第一名 902    902    第二名903  高中部 高一     第一名 102    第二名101,106 高二     第一名 116    第二名115 高三     第一名 125    第二名123  "
12,10012,檢送「110學年度第1學期臺北市國民教育輔導團國中自然科學領域輔導小組辦理自然科學領域召集人回流工作坊實施計畫」1份,教務處,教學組幹事,2021-12-22 12:24:29,
13,10013,轉知-函轉有關教師法第26條第2項所稱「復議」之定義一案,人事室,人事助理,2021-12-22 15:00:07,一、依據110年12月20日臺教人(三)字第1100167388號函辦理。一、依據110年12月20日臺教人(三)字第1100167388號函辦理。二、查教師法第26條第2項規定：「高級中等以下學校教師涉有第14條至第16條或第18條規定之情形，學校教師評審二、查教師法第26條第2項規定：「高級中等以下學校教師涉有第14條至第16條或第18條規定之情形，學校教師評審    委員會未依規定召開、審議或決議，主管機關認有違法之虞時，應敘明理由交回學校審議或復議；屆期未依法審    委員會未依規定召開、審議或決議，主管機關認有違法之虞時，應敘明理由交回學校審議或復議；屆期未依法審    議或復議者，主管機關得敘明理由逕行提交教師專業審查會審議，並得追究學校相關人員責任。」    議或復議者，主管機關得敘明理由逕行提交教師專業審查會審議，並得追究學校相關人員責任。」三、前開規定所稱「復議」，係主管機關基於行政監督之立場，要求學校就教師評審委員會已決議案件重開行政程序三、前開規定所稱「復議」，係主管機關基於行政監督之立場，要求學校就教師評審委員會已決議案件重開行政程序    之規定，主管機關依該規定交回學校復議時，學校即應重行審議，依法作成新決議。    之規定，主管機關依該規定交回學校復議時，學校即應重行審議，依法作成新決議。四、檢附教育部原函。四、檢附教育部原函。
14,10014,轉知-國立暨南國際大學中國語文學系111學年度碩士班入學考試即將開始報名，檢送招生海報電子檔,人事室,人事助理,2021-12-22 15:33:01,一、報名期間：110年12月22日上午9時至111年1月17日下午3時(下午3時30分繳費截止)。一、報名期間：110年12月22日上午9時至111年1月17日下午3時(下午3時30分繳費截止)。二、筆試日期：111年2月20日(星期日)。二、筆試日期：111年2月20日(星期日)。三、筆試科目：中國文學史(僅筆試一科，免口試)。三、筆試科目：中國文學史(僅筆試一科，免口試)。
15,10015,[高三升學]轉知美和科大社會工作系日間部四技原住民族專班招生資訊,教務處,註冊組幹事,2021-12-22 16:38:54,轉知美和科大社會工作系日間部四技原住民族專班招生資訊轉知美和科大社會工作系日間部四技原住民族專班招生資訊
16,10016,[高三升學]轉知國立體育大學111學年度陸上、球類、技擊運動技術學系學士班單獨招生資訊,教務處,註冊組幹事,2021-12-23 08:31:32,轉知國立體育大學111學年度陸上、球類、技擊運動技術學系學士班單獨招生資訊轉知國立體育大學111學年度陸上、球類、技擊運動技術學系學士班單獨招生資訊說明：說明：一、網路報名日期：111年1月7日（星期五）上午9時至111年2月14日（星期一）下午2時。一、網路報名日期：111年1月7日（星期五）上午9時至111年2月14日（星期一）下午2時。二、術科測驗日期：除射擊飛靶項目於111年3月5日考試，擊劍項目於111年3月7日考試，男子棒球項目於111年3月11日考試外，其餘項目皆於111年3月4日（星期五）辦理。二、術科測驗日期：除射擊飛靶項目於111年3月5日考試，擊劍項目於111年3月7日考試，男子棒球項目於111年3月11日考試外，其餘項目皆於111年3月4日（星期五）辦理。三、簡章免費下載，相關招生資訊請參閱該校招生訊息網頁（網址：http://exam.ntsu.edu.tw）三、簡章免費下載，相關招生資訊請參閱該校招生訊息網頁（網址：http://exam.ntsu.edu.tw）
17,10017,明日12月24日的葷食副菜「搖搖薯球」更改為「薯條」,衛生組,學創-衛生,2021-12-23 13:47:33,學校通知：明日12月24日的葷食副菜「搖搖薯球」，因供貨不足，需更改菜色，故將副菜更改為「薯條」，造成不便，敬請見諒．
18,10018,教育局辦理 「臺北市111學年度國際交換學生學習實施計畫」，請各校提醒擬參加甄選美國交換之學生，應於110年12月27日前至本局評選之代辦公司完成ELTiS英語測驗檢定，逾期恕無法受理,訓育組,訓育幹事,2021-12-23 15:34:55,
19,10019,臺北市兒童新樂園自111年1月24日(週一)起，全面恢復正常營運時段,訓育組,訓育幹事,2021-12-23 15:41:20,
20,10020,轉知-檢送臺北市111年度市立國民中學候用校長甄選儲訓須知及相關附件各1份,人事室,人事助理,2021-12-24 07:55:08,一、依據110年12月10日臺北市111年度市立國民中學候用校長甄選儲訓委員會第1次會議決議辦理。一、依據110年12月10日臺北市111年度市立國民中學候用校長甄選儲訓委員會第1次會議決議辦理。二、111年度市立國民中學候用校長甄選錄取名額為6名。二、111年度市立國民中學候用校長甄選錄取名額為6名。三、本次甄選報名時間及方式如下：三、本次甄選報名時間及方式如下： (一)報名時間： 110年12月27日（星期一）上午9時至111年1月5日（星期三）下午4時止。 (一)報名時間： 110年12月27日（星期一）上午9時至111年1月5日（星期三）下午4時止。 (二)本次採線上報名，請逕至臺北市政府教育局國中候用校長報名網頁 (二)本次採線上報名，請逕至臺北市政府教育局國中候用校長報名網頁    （網址：https://ppjhs.tp.edu.tw/ppjhs108/SSO）填妥報名表件，並上傳證明文件電子檔。    （網址：https://ppjhs.tp.edu.tw/ppjhs108/SSO）填妥報名表件，並上傳證明文件電子檔。 (三)甄選儲訓須知及相關表件請至臺北市政府教育局國中候用校長報名網頁 (三)甄選儲訓須知及相關表件請至臺北市政府教育局國中候用校長報名網頁    （網址：https://ppjhs.tp.edu.tw/ppjhs108/SSO）下載。    （網址：https://ppjhs.tp.edu.tw/ppjhs108/SSO）下載。
21,10021,轉知-111學年度【國立臺北護理健康大學生死與健康心理諮商系碩士班招生】,人事室,人事助理,2021-12-24 08:05:20,一、生死與健康心理諮商系碩士班招生報名期間110年12月1日至111年1月14日。一、生死與健康心理諮商系碩士班招生報名期間110年12月1日至111年1月14日。二、招生名額：諮商心理組7名、生死學組5名。二、招生名額：諮商心理組7名、生死學組5名。三、簡章下載請至國立臺北護理健康大學首頁→招生訊息，三、簡章下載請至國立臺北護理健康大學首頁→招生訊息，    網址：https://examweb.ntunhs.edu.tw/admission/detail/webSN/1/articlesn/639    網址：https://examweb.ntunhs.edu.tw/admission/detail/webSN/1/articlesn/639四、如有報考詢問事項，請逕洽承辦聯絡人周佳靜，聯絡電話：(02)28227101#7251。四、如有報考詢問事項，請逕洽承辦聯絡人周佳靜，聯絡電話：(02)28227101#7251。
22,10022,中原大學華語文教學中心「111年華語文遠距師資及教學實務培訓班」簡章及海報，請參閱。,教務處,實研幹事,2021-12-24 08:13:21,主旨：中原大學華語文教學中心「111年華語文遠距師資及教學實務培訓班」簡章及海報，請詳閱說明及附件。說明：一、本校華語文教學中心訂於111年3月19日至6月25日週末辦理華語文師資班，共計135小時。二、旨揭課程結合理論與實務，包含「教育部對外華語教學能力認證」考試之核心考科，符合課程時數出席規定，並通過試教者，可取得研習證明。三、本課程採實體及線上同步授課，課程資訊及優惠辦法請參閱簡章。線上報名網址：https://reurl.cc/ARxNAe。
23,10023,轉知-國立臺北護理健康大學資訊管理系111學年度碩士班暨在職專班招生,人事室,人事助理,2021-12-24 08:15:28,一、本招生一律採網路報名，報名日期自110年12月01日（星期三）上午09：00起至111年01月14日（星期五）下午23：59止。一、本招生一律採網路報名，報名日期自110年12月01日（星期三）上午09：00起至111年01月14日（星期五）下午23：59止。二、國立臺北護理健康大學資訊管理系碩士班招生名額：一般生(含在職生)共5名。二、國立臺北護理健康大學資訊管理系碩士班招生名額：一般生(含在職生)共5名。三、國立臺北護理健康大學資訊管理系碩士班招生科目：三、國立臺北護理健康大學資訊管理系碩士班招生科目： (一)第一階段：書面資料審查(100%) (一)第一階段：書面資料審查(100%) (二)第二階段：面試(100%) (二)第二階段：面試(100%)四、招生簡章於國立臺北護理健康大學首頁/招生資訊公告，不另發售紙本簡章，考生可自行由網頁查詢或列印四、招生簡章於國立臺北護理健康大學首頁/招生資訊公告，不另發售紙本簡章，考生可自行由網頁查詢或列印   （簡章及相關附件下載：https://examweb.ntunhs.edu.tw/upload/articles_file/615422153e0cb.pdf）   （簡章及相關附件下載：https://examweb.ntunhs.edu.tw/upload/articles_file/615422153e0cb.pdf）五、報考資格、報名事宜及其他相關事項等，請詳招生簡章。五、報考資格、報名事宜及其他相關事項等，請詳招生簡章。
24,10024,函轉教育部委請臺北市立大學（下稱北市大）辦理110年「校長暨教師專業發展支持作業平臺」功能擴充說明會,教務處,教學組幹事,2021-12-24 10:48:42,
25,10025,國立教育廣播電臺「111年麥寶電波－廣播親近校園計畫」自即日起至111年1月29日止開放申請,教務處,教學組幹事,2021-12-24 10:54:23,
26,10026,臺北市青少年發展處之免費講座：「創業實踐之路-菜市場的千萬品牌電商」,輔導室,輔導幹事,2021-12-24 13:28:59,一、經由講師職涯經驗分享，讓年輕學子認識各行各業，藉以了解自身興趣及性向，進而找到未來的道路與建立自我價值；團圓堅果創辦人劉家昇老師帶您初探電商的真實面貌。二、活動說明如下：(一)參加對象：青少年學子及一般民眾。(二)活動時間：111年1月8日（星期六）下午2時30分至4時10分。(三)報名方式：網路報名（https://reurl.cc/6DWEbk）。(四)報名費用：免費。(五)活動地點：臺北市青少年發展處6樓大研討室（臺北市中正區仁愛路1段17號）。三、宣傳稿內容如下：(一)90字：臺北市青少年發展處1月8日14:30舉辦達人開講「創業實踐之路-菜市場的千萬品牌電商」，劉家昇老師與您分享電商的真實面貌，以及過程中的挑戰。活動免費，詳見青發處官網。(二)60字：臺北市青少年發展處1月8日14:30舉辦達人開講：創業實踐之路-菜市場的千萬品牌電商。劉家昇與您分享生涯經歷；活動免費詳見青發處官網。(三)30字：青發處1/8劉家昇開講：創業實踐之路-菜市場的千萬品牌電商。活動免費詳官網。四、若對本活動有任何問題，請洽聯絡窗口：02-23514078轉1761，莊先生。
27,10027,[高三]110學年度第1學期期末考—考程表,教務處,教學組幹事,2021-12-24 14:28:08,公告［高三］110學年度第1學期第3次定期評量(期末考)考程表考試日期：110.12.29(三)、110.12.30(四)考試年段：高三詳細考程表請見附件。註：國一～高二之第3次定期評量將於111.1.18、111.1.19舉行，考程表將於考前另行公告。
28,10028,轉知國立臺灣師範大學辦理「中華民國參加2022年第15屆國際地球科學奧林匹亞競賽國家代表隊選拔及培訓要點」1份,教務處,設備幹事,2021-12-24 15:28:24,
29,10029,檢送教育部普通高級中學課程藝術生活學科中心全國教師專業成長研習-從多元選修線上課程「影像作為表述與參與的方式」出發-[素養導向]《認識動畫基礎與教學》工作坊」實施計劃乙份,教務處,教學組幹事,2021-12-25 09:53:38,
30,10030,111年度高級中等學校專業群科專任教師赴公民營機構研習或研究寒假報名相關事宜,教務處,教學組幹事,2021-12-25 09:54:25,
31,10031,檢送「110學年度中小學媒體素養教育教師研習計畫」1份,教務處,教學組幹事,2021-12-25 09:56:14,
32,10032,教育部實踐藝術教學實踐研究分區發表會，請藝術領域視覺藝術教師踴躍參加,教務處,教學組幹事,2021-12-25 09:56:56,
33,10033,教育部設計思考跨領域人才培育苗圃A類鋪植型苗圃計畫-初階種子教師工作坊,教務處,教學組幹事,2021-12-27 08:19:52,
34,10034,轉知-「師鐸獎評選及表揚活動實施要點」第7點，業經教育部於中華民國110年12月21日以臺教師（三）字第1100166606A號令修正發布,人事室,人事助理,2021-12-27 08:32:03,一、依教育部110年12月21日臺教師(三)字第1100166606B號函辦理。一、依教育部110年12月21日臺教師(三)字第1100166606B號函辦理。二、旨案電子檔得於教育部主管法規查詢系統（http://edu.law.moe.gov.tw）下載。二、旨案電子檔得於教育部主管法規查詢系統（http://edu.law.moe.gov.tw）下載。三、若對該行政規則有任何疑問，請逕洽教育部師資培育及藝術教育司潘小姐（電話：02-7736-5726）。三、若對該行政規則有任何疑問，請逕洽教育部師資培育及藝術教育司潘小姐（電話：02-7736-5726）。
35,10035,轉知-教育部「師鐸獎評選及表揚活動實施要點」第7點，業經該部於110年12月21日以臺教師（三）字第1100166606A號令修正發布,人事室,人事助理,2021-12-27 08:38:07,一、依據教育部110年12月21日臺教師(三)字第1100166606B號函辦理。一、依據教育部110年12月21日臺教師(三)字第1100166606B號函辦理。二、本案電子檔得於教育部主管法規查詢系統（http://edu.law.moe.gov.tw）下載。二、本案電子檔得於教育部主管法規查詢系統（http://edu.law.moe.gov.tw）下載。三、若對本行政規則有任何疑問，請逕洽教育部師資培育及藝術教育司潘小姐（電話：02-7736-5726）。三、若對本行政規則有任何疑問，請逕洽教育部師資培育及藝術教育司潘小姐（電話：02-7736-5726）。
36,10036,轉知-國立嘉義大學管理學院碩士在職專班111學年度招生資訊,人事室,人事助理,2021-12-27 08:43:08,旨揭招生報名日期自111年1月14日至2月14日下午5時止，一律採網路報名，招生簡章下載與報名網址：旨揭招生報名日期自111年1月14日至2月14日下午5時止，一律採網路報名，招生簡章下載與報名網址：      https://admissions.ncyu.edu.tw/www.aspx?webprjno=AAAG。      https://admissions.ncyu.edu.tw/www.aspx?webprjno=AAAG。二、本校管理學院碩士在職專班已有千餘位畢業校友，遍布各行各業且都有傑出的表現，111學年度招收一般管理組二、本校管理學院碩士在職專班已有千餘位畢業校友，遍布各行各業且都有傑出的表現，111學年度招收一般管理組    60名及創意產業與觀光休閒管理組40名，合計100名。    60名及創意產業與觀光休閒管理組40名，合計100名。三、該專班整合管理學院豐富且優質的師資，提供多元且兼具理論與實務課程；採週末上課方式，使學生得以兼顧工作、三、該專班整合管理學院豐富且優質的師資，提供多元且兼具理論與實務課程；採週末上課方式，使學生得以兼顧工作、    學業及家庭；以專業實務報告取代碩士論文，為在職進修最佳選擇，歡迎非商管或商管科系畢業者報考。    學業及家庭；以專業實務報告取代碩士論文，為在職進修最佳選擇，歡迎非商管或商管科系畢業者報考。四、檢附招生文宣海報1份，請協助宣傳。四、檢附招生文宣海報1份，請協助宣傳。
37,10037,轉知-國立嘉義大學教育學系111學年度數理教育碩士在職專班招生,人事室,人事助理,2021-12-27 08:47:43,一、報名日期：111年1月4日至1月24日(一律網路報名)。一、報名日期：111年1月4日至1月24日(一律網路報名)。二、面試日期：111年3月26日(星期六)。二、面試日期：111年3月26日(星期六)。三、本班上課時間為星期五晚上及星期六。三、本班上課時間為星期五晚上及星期六。
38,10038,轉知：高級中等以下學校表演藝術類團隊練習因應COVID-19防疫注意事項，詳附件。,活動組,活動幹事,2021-12-27 08:56:59,
39,10039,轉知：臺北市立永春高中辦理「XR實境教育創意大賞」競賽簡章，詳附件。,活動組,活動幹事,2021-12-27 09:00:49,
40,10040,南門自造教育及科技中心辦理「111年1至5月教師培訓研習」課程,教務處,教學組幹事,2021-12-27 09:26:16,
41,10041,轉知-公務人員退休撫卹基金管理委員會配合軍公教人員退撫基金提撥費率自111年1月1日起調整為14%，業修正退撫基金費用繳費標準，屆時依修正後之繳費標準繳納基金費用,人事室,人事助理,2021-12-27 11:28:30,依教育部110年12月15日臺教人(四)字第1100171160號書函轉公務人員退休撫卹基金管理委員會110年12月10日台管業一字依教育部110年12月15日臺教人(四)字第1100171160號書函轉公務人員退休撫卹基金管理委員會110年12月10日台管業一字第1101618044號函辦理，並檢附原函影本1份。第1101618044號函辦理，並檢附原函影本1份。
42,10042,[國三升學]轉知新北市立樹林高中111學年度原住民專班招生簡章,教務處,註冊組幹事,2021-12-27 13:01:10,新北市立樹林高中111學年度原住民專班招生簡章新北市立樹林高中111學年度原住民專班招生簡章說明：說明：一、招生對象：招收基北區(基隆市、台北市、新北市)及共同就學區(桃園市龜山區)之品德優良、具學習潛力或有意願傳承原住民文化之國中應屆原住民族畢業生。一、招生對象：招收基北區(基隆市、台北市、新北市)及共同就學區(桃園市龜山區)之品德優良、具學習潛力或有意願傳承原住民文化之國中應屆原住民族畢業生。二、報名送件時間：111年3月11日（星期五）起至111年5月20日（星期五）止。二、報名送件時間：111年3月11日（星期五）起至111年5月20日（星期五）止。三、報名費：免費。三、報名費：免費。四、簡章暨報名表（附件一）及原住民專班簡介（附件二），可自行影印或至該校校網（https://www.slsh.ntpc.edu.tw/）首頁下載使用。四、簡章暨報名表（附件一）及原住民專班簡介（附件二），可自行影印或至該校校網（https://www.slsh.ntpc.edu.tw/）首頁下載使用。五、如有疑問或升學宣導需求，歡迎電洽(02)86852011分機4405。五、如有疑問或升學宣導需求，歡迎電洽(02)86852011分機4405。
43,10043,111年國民法官模擬法庭前進校園活動種子教師培訓營(第一期),生輔組,生輔組組長,2021-12-27 14:07:56,一、國教署函轉法官學院「111年國民法官模擬法庭前進校園活動種子教師培訓營(第一期)」，請轉知貴校教師踴躍參與，請核示！二、旨揭為深耕校園法治教育於明年1月21日(週五)辦理培訓營，以國高中及大專院校教師為主，共培訓40人。三、報名期限訂於1月3日12時至1月5日17時止，網站報名(網址：http://tpireg.judicial.gov.tw/jasignup/signupsite/)。四、凡參加研習營之教師於研習期滿後，依上課時數核予學習時數認證，請鼓勵教師參加，並建議給予公假。
