,nid,title,department,staff,time,text
940,10940,[獎助學金]轉知嘉新兆福文化基金會111年度嘉新獎學金,教務處,註冊組幹事,2022-03-11 13:11:41,嘉新兆福文化基金會111年度嘉新獎學金嘉新兆福文化基金會111年度嘉新獎學金說明：說明：本次獎學金自今年3月16日起開始申請，至4月30日截止，並一律採線上申請方式。同學可自行至網站申請 https://application.chf.ngo/award/education。本次獎學金自今年3月16日起開始申請，至4月30日截止，並一律採線上申請方式。同學可自行至網站申請 https://application.chf.ngo/award/education。
941,10941,在職教師雙語教學研習坊,教務處,陳韻萍,2022-03-11 14:37:46,
942,10942,110學年度語文領域客語部編版教材結合教學運用方式研習,教務處,陳韻萍,2022-03-11 14:39:29,
943,10943,塔羅心靈成長-自我陪伴之旅研習實施計畫,教務處,陳韻萍,2022-03-11 14:50:40,
944,10944,110學年度第二學期 【國中】Language Corner分班結果，詳見附加檔案，敬請查閱。,教務處,實研幹事,2022-03-11 15:00:02,                              公        告                              公        告  110學年度第二學期【國中】Language Corner分班結果，詳見附加檔案，敬請查閱。  110學年度第二學期【國中】Language Corner分班結果，詳見附加檔案，敬請查閱。Language Corner   說明：  1. Language Corner課程，因學生報名踴躍，故開設二班，分別為周一及周四第八節。  1. Language Corner Language Corner課程，因學生報名踴躍，故開設二班，分別為周一及周四第八節。  2.分班名冊、上課地點、教師姓名及上課日期，詳見附加檔案。  2.分班名冊、上課地點、教師姓名及上課日期，詳見附加檔案。  3.請同學注意上課時間，準時上課，不得無故缺席。  3.請同學注意上課時間，準時上課，不得無故缺席。，不得無故缺席        
945,10945,轉知:「教育部國民及學前教育署委託推動校園修復式正義彈性時間課程教學演示」,生輔組,學創-生輔林,2022-03-11 15:10:36,
946,10946,轉知-行政院人事行政總處公務人力發展學院(南投院區)111年4、5月數位知能類班期，部分班期尚有名額,人事室,人事助理,2022-03-11 15:50:06,依據教育部111年3月10日臺教人(一)字第1110024585號書函轉行政院人事行政總處公務人力發展學院111年3月7日依據教育部111年3月10日臺教人(一)字第1110024585號書函轉行政院人事行政總處公務人力發展學院111年3月7日人發數字第1110800073號函辦理，並檢附原書函及附件影本各1份。人發數字第1110800073號函辦理，並檢附原書函及附件影本各1份。
947,10947,轉知-國立彰化師範大學進修學院推廣教育課程招生簡章共3門課程,人事室,人事助理,2022-03-11 15:57:13,"一、國立彰化師範大學進修學院推廣教育課程：一、國立彰化師範大學進修學院推廣教育課程： (一)「CBM嬰幼兒撫觸按摩與知覺動作遊戲檢定班」課程時間為111年5月15日(日)9：30~12：30、111年5月22日 (一)「CBM嬰幼兒撫觸按摩與知覺動作遊戲檢定班」課程時間為111年5月15日(日)9：30~12：30、111年5月22日       (日)9：30~12：30、111年5月29日(日)10：30~12：30，3天合計共8小時，公務人員及教師可登錄研習時       (日)9：30~12：30、111年5月29日(日)10：30~12：30，3天合計共8小時，公務人員及教師可登錄研習時       數，課程費用每人4,000元，4/10前報名享早鳥優惠每人3,600元。       數，課程費用每人4,000元，4/10前報名享早鳥優惠每人3,600元。 (二)「DS嬰幼兒動能知覺瑜珈檢定班」課程時間為111年5月15日(日)14：30~17：30、111年5月22日(日)14：30~ (二)「DS嬰幼兒動能知覺瑜珈檢定班」課程時間為111年5月15日(日)14：30~17：30、111年5月22日(日)14：30~       17：30、111年5月29日(日)14：30~16：30，3天合計共8小時，公務人員及教師可登錄研習時數，課程費用       17：30、111年5月29日(日)14：30~16：30，3天合計共8小時，公務人員及教師可登錄研習時數，課程費用       每人4,000元，4/10前報名享早鳥優惠每人3,600元。       每人4,000元，4/10前報名享早鳥優惠每人3,600元。 (三)「NBF嬰幼兒副食品設計及製作研習班」課程時間為111年6月12日(日)13：30~17：30、111年6月19日(日) (三)「NBF嬰幼兒副食品設計及製作研習班」課程時間為111年6月12日(日)13：30~17：30、111年6月19日(日)       13：30~17：30，2天合計共8小時，公務人員及教師可登錄研習時數，課程費用每人4,000元，5/15前報名享       13：30~17：30，2天合計共8小時，公務人員及教師可登錄研習時數，課程費用每人4,000元，5/15前報名享       早鳥優惠每人3,600元。       早鳥優惠每人3,600元。二、報名步驟：線上報名，請至該校進修學院報名管理系統報名。如第一次報名，請先申請帳號。二、報名步驟：線上報名，請至該校進修學院報名管理系統報名。如第一次報名，請先申請帳號。              （https://aps.ncue.edu.tw/cee/index.php）              （https://aps.ncue.edu.tw/cee/index.php）三、報名規定及其他課程資訊請詳閱各課程招生簡章，如有相關問題，請逕向簡章中聯絡人洽詢。三、報名規定及其他課程資訊請詳閱各課程招生簡章，如有相關問題，請逕向簡章中聯絡人洽詢。"
948,10948,生涯體驗營：VR虛擬實境生涯應用,教務處,陳韻萍,2022-03-14 07:54:12,
949,10949,轉知國立臺灣大學科學教育發展中心辦理「探索基礎科學系列講座第27期─驅動台灣社會的輪子：台灣二戰後車輛發展史面面觀」,教務處,設備幹事,2022-03-14 08:03:43,
950,10950,轉知城市學校財團法人臺北城市科技大學辦理「高教深耕計畫」之A3-2 舉辦三創競賽活動，將舉辦「2022智慧綠能創意實作專題競賽」,教務處,設備幹事,2022-03-14 08:11:13,
951,10951,高中化學課程地圖為本之素養課程設計(評量篇),教務處,陳韻萍,2022-03-14 07:57:43,
952,10952,北二區教師專業成長研習－文學、戲曲、美術情工作坊-實施計畫,教務處,陳韻萍,2022-03-14 08:27:06,
953,10953,公告-本校111學年度第1次教師甄選,人事室,人事室主任,2022-03-14 08:53:07,本次甄選科別、名額如下：本次甄選科別、名額如下：※正式教師※正式教師高中部高中部輔導科1名輔導科1名國中部國中部國中部特殊教育身心障礙組1名特殊教育身心障礙組1名報名日期：報名日期：初試網路報名111.3.14（一）-111.4.15（五）初試網路報名111.3.14（一）-111.4.15（五）複試現場報名111.4.30(六)複試現場報名111.4.30(六)甄選日期：甄選日期：初試：111年4月23日(六)初試：111年4月23日(六)複試：111年4月30日(六)複試：111年4月30日(六)其餘詳見附件111學年度第1次教師甄選簡章其餘詳見附件111學年度第1次教師甄選簡章其餘詳見附件111學年度第1次教師甄選簡章教師甄選網路報名系統：教師甄選網路報名系統：http://web.jhenggao.com/iTeacherSignUp_nccu/system1.asphttp://web.jhenggao.com/iTeacherSignUp_nccu/system1.asp
954,10954,轉知衛生福利部業於本(111)年3月1日以衛授疾字第1110200210號公告「嚴重特殊傳染性肺炎(COVID-19)防疫措施裁罰規定」，請查照並配合辦理。,衛生組,學創-衛生,2022-03-14 10:56:41,
955,10955,轉知衛生福利部國民健康署（以下簡稱國健署）訂於111年3月17日(星期四)舉辦「APEC倡議4E（飲食、運動、生態、經濟）實現星球健康之國際研討會」相關訊息，請鼓勵教職員工生踴躍參加並協助周知,衛生組,學創-衛生,2022-03-14 11:04:51,
956,10956,轉知臺北市政府教育局辦理111年度中小學資通訊應用大賽實施計畫,教務處,設備幹事,2022-03-14 12:42:23,
957,10957,轉知財團法人國家實驗研究院國家太空中心擬辦理全國水火箭比賽，遴選最佳隊伍參加國際競賽,教務處,設備幹事,2022-03-14 12:46:47,
958,10958,臺北市政府原住民族事務委員會(以下簡稱市府原民會)「臺北市原住民族語言能力認證測驗獎勵」請參閱。,教務處,實研幹事,2022-03-14 13:02:02,"主旨：臺北市政府原住民族事務委員會(以下簡稱市府原民會)「臺北市原住民族語言能力認證測驗獎勵」請詳閱說明及附件。說明：一、相關獎勵申請事項說明如下（詳如計畫內容）：       (一)獎勵對象：             1.個人獎勵（須同時符合下列條件）：                (1)設籍本市4個月（含）以上。                (2)通過原住民族語言能力認證測驗中高級（含）以上級數者。                (3)同等級以申請一次為限。             2.族語家庭獎勵（須同時符合下列條件）：                (1)設籍本市4個月（含）以上。                (2)同戶籍家庭成員達2名（含）以上通過同場次原住民族語言能力認證測驗（不限通過級數），其中通過成員至少1名年齡須達18歲以上。                (3)個別家庭成員通過同等級以申請一次為限。      (二)通過原住民族語言能力認證測驗獎勵金額度如下：            1.個人獎勵：               (1)中高級：獎勵新臺幣1萬元。               (2)高級：獎勵新臺幣2萬元。               (3)優級：獎勵新臺幣3萬元。            2.族語家庭獎勵：              (1)同戶籍家庭成員通過認證達2名，每戶獎勵新臺幣 6,000元；若通過成員超過2名以上，每多1名即增加獎勵新臺幣3,000元。              (2)每戶最高獎勵新臺幣1萬5,000元。     (三)申請期限：採網路申請，申請人（族語家庭獎勵由一人代表申請）於族語認證成績公告後同年4月1日起至7月31日止，               登入本市「市民服務大平臺」（https://service.gov.taipei/）搜尋「臺北市原住民族語言能力認證測驗獎勵」填寫申請，逾期不受理。二、檢附旨揭實施計畫及原函各1份。"
959,10959,鼓勵教育人員及行政人員報名參與教育部「111年閩南語語言能力認證考試資訊監試人員培訓研習」，請參閱。,教務處,實研幹事,2022-03-14 13:06:00,主旨：鼓勵教育人員及行政人員報名參與教育部「111年閩南語語言能力認證考試資訊監試人員培訓研習」，請詳閱說明及附件。說明：一、本研習課程預計於全國辦理6場次，每場次約40人，每次上課時間為半日，均為實體課程，包括「基礎知能」及「實作演練」2部分。           其培訓對象不限身分，採線上報名。倘培訓期間全勤並通過結訓考核者，始得推薦進入本認證考試總試務中心專業人才資料庫。二、倘對本研習內容有任何問題，可聯洽承辦單位國立臺灣師範大學進修推廣學院測驗培訓組呂小姐。E-mail信箱： queenielu@ntnu.edu.tw／電話：02-77495820。三、檢送研習簡章1份。
960,10960,國立臺灣師範大學辦理「111年度『Cool English普技高口說菁英』活動辦法」1份，請參閱。,教務處,實研幹事,2022-03-14 13:07:46,主旨：國立臺灣師範大學辦理「111年度『Cool English普技高口說菁英』活動辦法」1份，請詳閱說明。說明：一、依據國立臺灣師範大學111年3月1日師大英語字第1111004554號函。二、為增進高級中等學校學生運用Cool English英語線上學習平臺之「口說」學習專區，透過口語練習，協助學生練習正確的字母發音，            強化學生英語口說能力，鼓勵學生開口說英語，特請國立臺灣師範大學辦理旨揭活動。三、活動期間自111年3月28日起至111年4月29日止，詳細內容請參閱活動辦法。本案相關未盡事宜，請逕洽Cool English英語線上學習平臺客服專線，           聯絡電話：02-7749-7997；信箱： coolenghshelp＠gmail.com。四、副本抄送各直轄市政府教育局及各縣市政府，請協助通知參加高級中等教育階段非學校型態實驗教育學生踴躍報名活動。
961,10961,醒吾科技大學辦理「2022全國高中職校雙語實作教學創作比賽」，邀請貴校學生踴躍報名參加，請查照。,教務處,實研幹事,2022-03-14 13:09:45,主旨：醒吾科技大學辦理「2022全國高中職校雙語實作教學創作比賽」，請參閱。說明：一、醒吾科技大學辦理「2022全國高中職校雙語實作教學創作比賽」，期以增加學校之間的交流機會，並提高全國高中職校學生之語言學習風氣。二、報名時間：即日起至3月31日止。三、活動時間：影音檔案上傳至111年4月8日止。四、比賽方式：請詳比賽辦法。五、隨函檢附比賽辦法及報名表格。
962,10962,地理科加深加廣選修-社會環境議題課程增能系列研習(線上研習),教務處,陳韻萍,2022-03-14 13:51:42,
963,10963,臺北市健康與護理科跨校社群共備研習,教務處,陳韻萍,2022-03-14 13:54:05,
964,10964,檢送本市「111學年度第1學期國民教育階段學生辦理非學校型態實驗教育」申請書暨相關表件各1份，請參閱。,教務處,實研幹事,2022-03-14 15:27:57,主旨：臺北市政府教育局檢送「111學年度第1學期國民教育階段學生辦理非學校型態實驗教育」申請書暨相關表件各1份，請詳閱及附件。說明：一、依據高級中等以下教育階段非學校型態實驗教育實施條例及臺北市國民教育階段辦理非學校型態實驗教育補充規定辦理。二、自106學年度起，本市非學校型態實驗教育採線上申請，網址為https://tpnee.tp.edu.tw，網站使用相關事宜請洽辛太科技，        諮詢電話：02-27487499，另本市非學校型態實驗教育之相關資訊，均公告於本市實驗教育創新發展中心官方網站，        網址為http://teecid.tp.edu.tw。法規及申請事宜請洽臺北市實驗教育創新發展中心非學校型態實驗教育專案教師劉威廷，聯絡電話：02-25626552轉11。三、依據本市「國民教育階段辦理非學校型態實驗教育作業流程圖」個人申請案部分說明如下：       (一)基於國民中小學係屬義務教育階段，學校應瞭解及掌握學生之學習情形，學生之法定代理人申請辦理個人非學校型態實驗教育計畫，              申請人於111年5月2日前，將個人申請表、委任書及家長需求表正本1式1份，親自送件（或掛號郵寄）方式，送達戶籍所屬學區學校教務處。       (二)申請人於111年4月30日上傳完成申請作業並送件至戶籍所屬學區學校，各校應於受理個人申請辦理實驗計畫後，成立專案小組，由校長擔任召集人，              於111年5月3日（星期二）至111年 5月9日（星期(二)期間召開會議，並於111年5月11日（星期三）前上傳學校與申請人擬定後之實驗教育計畫，              俾利後續審議工作。       (三)各項申請資料表件，亦可於本局網頁/科室業務/中等教育科/國中教育階段非學校型態實驗教育/臺北市111學年度第1學期國中教育階段非學校型態實驗             教育申請資料項下載使用。
965,10965,[獎助學金]轉知111年《第十一屆》臺北市國中、高中學校學生懷恩、陳玲基金會助學金申請辦法,教務處,註冊組幹事,2022-03-14 16:29:28,轉知111年《第十一屆》臺北市國中、高中學校學生懷恩、陳玲基金會助學金申請辦法轉知111年《第十一屆》臺北市國中、高中學校學生懷恩、陳玲基金會助學金申請辦法一、申請標準：凡就讀於本校低收入戶或清寒學生，上學期學業成績75分以上，無懲處紀錄，富有上進心者，皆可申請一、申請標準：凡就讀於本校低收入戶或清寒學生，上學期學業成績75分以上，無懲處紀錄，富有上進心者，皆可申請上學期學業成績75分以上，無懲處紀錄，富有上進心者，皆可申請75二、、申請方式：備妥以下表格，於111年4月11日前送至教務處註冊組二、、申請方式：備妥以下表格，於111年4月11日前送至教務處註冊組、申請方式：備妥以下表格，於111年4月11日前送至教務處註冊組(一)填具申請表(含收據)1份。)()1(二)自傳(六百字以內) 1份。)() 1(三)上學期學業成績單及獲獎紀錄證明書1份(高一新生請提供國三獲獎紀錄)。)1()(四)學生證正反面影印本。)
966,10966,110 學年度「社會情緒學習」（SEL）融入各領域課程與教學活動設計徵件,教務處,陳韻萍,2022-03-15 08:30:05,
967,10967,「十二年國教課綱國民中小學標準本位評量」國民中小學領航學校暨推廣學校計畫說明會改以線上方式辦理,教務處,陳韻萍,2022-03-15 08:42:16,
968,10968,科技領域素養導向課程規劃與實作分享實施計畫,教務處,陳韻萍,2022-03-15 08:47:21,
969,10969,科技女力翻新傳統化工～有機物在生活中的應用與實作,教務處,陳韻萍,2022-03-15 08:50:00,
970,10970,國立陽明交通大學資訊工程學系辦理「線上招生座談會」活動訊息,輔導室,輔導幹事,2022-03-15 08:52:27,
971,10971,國立臺北大學社會學系學士班招生海報,輔導室,輔導幹事,2022-03-15 08:55:27,
972,10972,轉知「111年藍色水路校外教學體驗計畫」案,訓育組,訓育幹事,2022-03-15 08:54:51,
973,10973,教育部國民及學前教育署推動高級中等學校學生學習歷程檔案110學年度學生課程學習成果分享會系列活動第三梯次實施計畫（雲嘉地區）」,輔導室,輔導幹事,2022-03-15 08:59:22,
974,10974,2022 桐花三行詩 徵選活動簡章(4/10止),圖書館,圖書閱讀教師,2022-03-15 10:27:30,徵選期程：即日起至 111 年 4 月 10 日止（以郵戳或報名網頁關閉為憑）。主辦單位：客家委員會 徵文主題：以賞桐、桐聚、遊程回憶或生態書寫等相關內容為主題。徵選類別、字數及件數 徵選類別分成「客語漢字組」與「中文組」兩大組分別徵文，每人至多投稿 3 件 為限，(一)客語漢字組：以客語漢字創作，格式為首句 5 字，第二、三句為 7 字。(二)繁體中文組：以繁體中文創作，格式為首句 5 字，第二、三句為 7 字。 (一)客語漢字組：以客語漢字創作，格式為首句 5 字，第二、三句為 7 字。(二)繁體中文組：以繁體中文創作，格式為首句 5 字，第二、三句為 7 字。 (二)繁體中文組：以繁體中文創作，格式為首句 5 字，第二、三句為 7 字。 格式為首句 5 字，第二、三句為 7 字每一份檔案內容僅限一首詩作，若有一首以上作品 欲投稿，須分次報名。投稿作品之創作題目(詩名)作為檔名，作品可使用掃描或攝影，以.pdf 格式或.jpg 格式檔案上傳。作品格式規定：(一)電腦繕打，紙張尺寸設為 A4，設定適當版面邊界，字體以新細明體為主，字體大小為 12 號，字體顏色為黑色。(二)以稿紙書寫 請以黑筆或藍筆繕寫於稿紙上，並務必注意字跡工整，可供辨識。(二)以稿紙書寫 請以黑筆或藍筆繕寫於稿紙上，並務必注意字跡工整，可供辨識。參選作品請勿書寫作者姓名，亦不得加註任何記號。字數不符合規定者，一概不列入評審。「2022 桐花三行詩」徵選小組聯繫方式： 電話：03-4869222。地址：桃園市龍潭區五福街 92 巷 2 弄 11 號。 電子信箱：migratorycreation@gmail.com。
975,10975,校園修復式正義彈性時間課程教學演示實施計畫,教務處,陳韻萍,2022-03-15 12:42:41,
976,10976,高中物理適性教材研發實驗計畫-學習歷程自述與多元綜整心得撰寫工作坊,教務處,陳韻萍,2022-03-15 12:46:44,
977,10977,新興科技教育遠距示範服務計畫之區域推廣中心,教務處,陳韻萍,2022-03-15 12:51:19,
978,10978,本校空間設計系與福智佛教基金會、關廟護生園區所舉辦「蔬食愛動物繪畫徵圖活動」，惠請公告並鼓勵學生踴躍報名參加,衛生組,學創-衛生,2022-03-15 13:51:31,
979,10979,函轉北美環境教育學會（NAAEE）舉辦2022年EE30 Under 30（全球環境教育青年領袖選拔）活動資訊一案，請鼓勵學生踴躍報名參加,衛生組,學創-衛生,2022-03-15 14:27:13,
980,10980,110-2第5週秩序競賽成績,生輔組,生輔幹事,2022-03-15 14:47:20,國中部七年級 第一名 705班  第二名 704班八年級 第一名 801班  第二名 802班、804班九年級 第一名 905班  第二名 902班、903班高中部十年級 第一名 102班  第二名 105班十一年即 第一名 112班  第二名 116班十二年級 第一名 123班  第二名 124班
983,10983,110-2第5週 整潔競賽成績,衛生組,學創-衛生,2022-03-15 15:39:04,110-2第5週整潔競賽成績 國中部 國一   第一名 701    第二名   704 和 704 705 國二   第一名 802    第二名   801 國三   第一名 903    第二名   905  高中部 高一   第一名 102    第二名   103 高二   第一名 111    第二名   116 高三   第一名 123    第二名    124
984,10984,成功大學辦理「2022春季全民台語認證」，鼓勵校內人員踴躍參與，請參閱。,教務處,實研幹事,2022-03-15 16:16:23,主旨：成功大學辦理「2022春季全民台語認證」，鼓勵校內人員踴躍參與，請詳閱說明及附件。說明：成功大學台灣語文測驗中心於本（2022）年5月28日（星期六）擴大辦理「2022春季全民台語認證」，網路報名時間為即日起至本年4月8日，              簡章及詳細資訊請至該中心官方網站查詢：https://ctlt.twl.ncku.edu.tw/gtpt/index.html。
985,10985,文化大學推廣教育部終身學習中心辦理「閩南語語言能力認證【拼音加強班】」、「閩南語語言能力認證【讀寫加強班】」、「閩南語語言能力認證【考試衝刺班】」研習訊息詳如說明。,教務處,實研幹事,2022-03-15 16:27:22,主旨：文化大學推廣教育部終身學習中心辦理「閩南語語言能力認證【拼音加強班】」、「閩南語語言能力認證【讀寫加強班】」、「閩南語語言能力認證            【考試衝刺班】」研習訊息詳如說明。說明：一、課程資訊：       (一)閩南語語言能力認證【拼音加強班】             1.上課日期與時間：111年05月15日至111年05月29日(星期日)9:00~16:00；總時數18小時，分三次上課。             2.本拼音加強班透過一系列課程，加強學員在閩南語的台羅拼音方面，做一全面性的輔導。             3.更多課程資訊，請參考連結網頁：https://www.sce.pccu.edu.tw/courses/0K33B1050。       (二)閩南語語言能力認證【讀寫加強班】             1.上課日期與時間：111年06月12日至111年06月26日(星期日)9:00~16:00；總時數18小時，分三次上課。             2.本讀寫加強班透過一系列課程，加強學員在閩南語的讀、寫方面，做一全面性的輔導。             3.更多課程資訊，請參考連結網頁：https://www.sce.pccu.edu.tw/courses/0K34B1060。       (三)閩南語語言能力認證【考試衝刺班】             1.上課日期與時間：111年07月10日至111年07月31日(星期日)9:00~16:00；總時數24小時，分四次上課。             2.本拼音加強班透過一系列課程，加強學員在閩南語的聽、說、讀、寫方面，做一全面性的輔導。並掌握解題要領與作答技巧。             3.更多課程資訊，請參考連結網頁：https://www.sce.pccu.edu.tw/courses/0K35B1070。以上課程目標皆以通過閩南語認證中高級(B2)，                    以期在就業或者個人價值提升，都能有顯著的效果。二、上課地點：本校推廣教育部(建國本部)-台北市大安區建國南路二段231號。三、若有相關問題請洽詢承辦人員：孫于涵小姐 02-2700-5858分機8524或總機1；郵件信箱yhhsun@sce.pccu.edu.tw
