,nid,title,department,staff,time,text
1585,11585,公告-本校111學年度第1次教師甄選錄取名單及報到注意事項,人事室,人事室主任,2022-04-30 17:58:57,國立政治大學附屬高級中學111學年度第1次教師甄選國立政治大學附屬高級中學111學年度第1次教師甄選1111錄取名單及報到注意事項錄取名單及報到注意事項一、依本校111學年度第1次教師甄選簡章、110學年度教師評審委員會第6次會議決議辦理。 一、依本校111學年度第1次教師甄選簡章、110學年度教師評審委員會第6次會議決議辦理。 11111106二、 錄取名單如下 二、 錄取名單如下 (一)高中部輔導科：（最低錄取分數:79.73分） (一)高中部輔導科：（最低錄取分數:79.73分） ):79.73正取1名:11060005李O真正取1名:11060005李O真1:11060005O備取1名:11060002唐O沁備取1名:11060002唐O沁1:11060002O(二)國中部特殊教育身心障礙組：（最低錄取分數: 80.29分）(二)國中部特殊教育身心障礙組：（最低錄取分數: 80.29分）): 80.29正取1名:11070004吳O輝正取1名:11070004吳O輝1:11070004O備取1名:11070002陳O翎備取1名:11070002陳O翎1:11070002O三、正取人員請於111年5月12日（星期四）中午12時前，至本校人事室報到及應聘（111年8月1日起聘），逾期未報到視同棄權，由備取人員依序遞補，不得異議。三、正取人員請於111年5月12日（星期四）中午12時前，至本校人事室報到11151212及應聘（111年8月1日起聘），逾期未報到視同棄權11181，由備取人員依序遞補，不得異議。四、 報到應備文件如下： 四、 報到應備文件如下： （一）公立醫療院所或健保地區（含）以上醫院體格檢查表(含胸部X光檢查)1份(可後補)。 （一）公立醫療院所或健保地區（含）以上醫院體格檢查表(含胸部X光檢查)1份(可後補)。 （二）如為現職人員，需附原任機關學校離職證明書或同意書。 （二）如為現職人員，需附原任機關學校離職證明書或同意書。      （三）學經歷證件、教師證、如為現職教師併附最近一次敘薪通知及最近一次考核通知書(請備齊正本)。     （三）學經歷證件、教師證、如為現職教師併附最近一次敘薪通知及最近一次考核通知書(請備齊正本)。
1586,11586,111 年度高級中等學校教師專業成長進修計畫 ——全英語及雙語教學研習 報名簡章,教務處,陳韻萍,2022-05-02 08:15:31,
1587,11587,[國中部]政大附中「線上語文常識挑戰賽×國八」競賽結果,圖書館,圖書閱讀教師,2022-05-02 08:58:45,國立政治大學附屬高級中學110學年度第二學期「線上語文常識挑戰賽×國八」競賽結果110 一、剔除未完整寫出班級、姓名之參賽者，及非國八的參賽同學，共計78人次。一、剔除未完整寫出班級、姓名之參賽者，及非國八的參賽同學，共計78人次。符合規定的參賽者，共計110人次。感謝同學熱烈參與。符合規定的參賽者，共計110人次。感謝同學熱烈參與。二、此競賽目的為鼓勵同學透過練習達到精熟。故於賽後提供連結，供同學自由練習。https://wordwall.net/play/30823/858/245二、此競賽目的為鼓勵同學透過練習達到精熟。故於賽後提供連結，供同學自由練習。https://wordwall.net/play/30823/858/245三、恭喜以下獲獎同學，將於實體上課時擇期頒獎。第一名　802班劉○○第二名　804班趙○○第三名　804班楊○○第四名　805班崔○○第五名　803班蔡○三、恭喜以下獲獎同學，將於實體上課時擇期頒獎。第一名　802班劉○○第二名　804班趙○○第三名　804班楊○○第四名　805班崔○○第五名　803班蔡○○○
1588,11588,[國三升學]轉知屏北高中「小清華原住民實驗教育班111學年度第一次免試入學獨立招生簡章」,教務處,註冊組幹事,2022-05-02 09:50:42,國立屏北高中「小清華原住民實驗教育班111學年度第一次免試入學獨立招生簡章」國立屏北高中「小清華原住民實驗教育班111學年度第一次免試入學獨立招生簡章」說明：說明：一、報名資格：須具有原住民族之身分，且就讀各縣市國民中學畢業生(含應屆、非應屆、具同等學力資格、非學校型態實驗教育學生)。一、報名資格：須具有原住民族之身分，且就讀各縣市國民中學畢業生(含應屆、非應屆、具同等學力資格、非學校型態實驗教育學生)。二、報名辦法：符合申請資格之學生，依其志願並經家長同意後，由就讀國中向該招生委員會集體報名，不收報名費。二、報名辦法：符合申請資格之學生，依其志願並經家長同意後，由就讀國中向該招生委員會集體報名，不收報名費。符合申請資格之學生，依其志願並經家長同意後，由就讀國中向該招生委員會集體報名，不收報名費。符合申請資格之學生，依其志願並經家長同意後，由就讀國中向該招生委員會集體報名，不收報名費。
1589,11589,「111年度都會區原住民族學生文化課程體驗營-SaySiyat 山林與織藝」，因應嚴重特殊傳染性肺炎(COVID-19)疫情暫延，請查照。,教務處,實研幹事,2022-05-02 09:58:35,通     知通     知國立臺中教育大學於111年5月14日及15日辦理「111年度都會區原住民族學生文化課程體驗營-SaySiyat 山林與織藝」，國立臺中教育大學於111年5月14日及15日辦理「111年度都會區原住民族學生文化課程體驗營-SaySiyat 山林與織藝」，因應嚴重特殊傳染性肺炎(COVID-19)疫情暫延，俟疫情穩定後另擇期辦理，請查照。
1590,11590,2022第27屆大專校院資訊應用服務創新競賽」(含高中高職組)線上校園說明會（如附件）,圖書館,資訊工程師,2022-05-02 10:24:33,
1591,11591,轉知「111年全國高級中等學校『孝道教育』微電影徵件競賽（主題：大聲說「孝」心連結）」實施計畫1份,訓育組,訓育幹事,2022-05-02 10:26:37,
1592,11592,第2屆中學生黑客松,圖書館,資訊工程師,2022-05-02 10:31:37,
1593,11593,110-2 政大附中5月份菜單—食家安,衛生組,學創-衛生,2022-05-02 10:45:25,
1594,11594,110學年度中區教師專業成長研習-「環境議題融入課程與《南風》紀實攝影探查」工作坊實施計畫,教務處,陳韻萍,2022-05-02 11:37:16,
1595,11595,生命教育學科中心辦理生命教育科「評量規準(草案)」及「課綱意見蒐集」焦點座談會,教務處,陳韻萍,2022-05-02 11:47:52,
1596,11596,111年5月4日辦理【清官神明－康熙朝臺灣循吏陳璸與周鍾瑄「神格化」的歷史因素】及111年5月18日辦理【走過留痕——虎字將軍劉明燈與台灣】線上直播教師研習,教務處,陳韻萍,2022-05-02 11:52:36,
1597,11597,臺北市立南湖高級中學 辦理臺北市歷史學科平台研習-線上研習,教務處,陳韻萍,2022-05-02 11:57:54,
1598,11598,111年云端耘心工作坊～第5期「自我連結與連結他人：薩提爾冰山對話全面解析、體驗與練習」課程實施計畫-線上課程,教務處,陳韻萍,2022-05-02 12:02:44,
1599,11599,110學年度第2學期代收代辦費公告,主計室,會計室主任,2022-05-02 14:27:29,
1600,11600,國立政治大學教育學院教師研習中心辦理｢111年度中等學校教師在職進修第二專長專門科目學分班｣正班及隨班附讀甄審簡章,教務處,陳韻萍,2022-05-02 14:33:29,
1601,11601,台北海洋科技大學舉辦「2022寵物業人才培育論壇」,教務處,陳韻萍,2022-05-02 14:37:47,
1602,11602,國立臺灣海洋大學辦理「運動內衣到咖啡的人工智慧課程的設計及調整」線上研習,教務處,陳韻萍,2022-05-02 14:40:05,
1603,11603,【05/02更新】本校防疫假修正,生輔組,生輔組組長,2022-05-02 16:18:25,防疫假規定修正1. 確診者：應主動告知學校，返校後憑就醫證明給予防疫假。1. 確診者：應主動告知學校，返校後憑就醫證明給予防疫假。2. 密切接觸者：實施居家隔離，返校後憑衛生主管機關開立之「居家隔離通知書」為證明，給予防2. 密切接觸者：實施居家隔離，返校後憑衛生主管機關開立之「居家隔離通知書」為證明，給予防疫假。3. 發燒症狀：耳溫≧38℃、額溫≧37.5℃，有咳嗽或非過敏性流鼻水等呼吸道症狀，應主動告知學3. 發燒症狀：耳溫≧38℃、額溫≧37.5℃，有咳嗽或非過敏性流鼻水等呼吸道症狀，應主動告知學校，並於就醫後在家休息，返校後憑診斷證明給予防疫假。4. 如學生及家長擔心個別健康情形、避免外出感染者，可請防疫假在家自我隔離，欲申請者：4. 如學生及家長擔心個別健康情形、避免外出感染者，可請防疫假在家自我隔離，欲申請者：(1)最遲於下午三點前填寫表單 https://forms.gle/o584CipZBGPq4YhK6 ，申請隔日之防疫假，逾時不予以申請。(1)最遲於下午三點前填寫表單 ，申請隔日之防疫假，逾時不予以申請。(2)並於返校三日內繳交本校假單及附件之切結書。(兩個文件都要)(2)並於返校三日內繳交本校假單及附件之切結書。(兩個文件都要)5. 請假期間如跨定期評量，需返校參加考試，並於返校後以本校假單銷假。5. 請假期間如跨定期評量，需返校參加考試，並於返校後以本校假單銷假。註：防疫假期間，學生請勿自行返校註：防疫假期間，學生請勿自行返校
1604,11604,函轉行政院環保署「111年校園資源循環議題環境教育種子教師培訓系列活動」，請貴校轉知教職員工踴躍參加，請查照。,衛生組,學創-衛生,2022-05-02 22:30:13,
1605,11605,函轉行政院環境保護署辦理「2022空品知識、行動與創意競賽」活動，並自111年4月22日開始報名，詳如說明，請貴校鼓勵學生踴躍報名參加，請查照。,衛生組,學創-衛生,2022-05-02 22:39:22,
1606,11606,轉知-檢送「教育部及所屬機關（構）學校111年度強化公務人員終身學習及專書閱讀推動計畫」1份,人事室,人事助理,2022-05-03 07:53:23,依據教育部111年4月27日臺教人(一)字第1110039949號書函辦理。依據教育部111年4月27日臺教人(一)字第1110039949號書函辦理。
1607,11607,轉知-行政院人事行政總處公務人力發展學院111年度訓練計畫電子檔業置於該學院全球資訊網（https://www.hrd.gov.tw/）之「檔案下載」頁面，歡迎下載應用,人事室,人事助理,2022-05-03 07:59:11,依據教育部111年4月27日臺教人(一)字第1110042416號書函轉行政院人事行政總處公務人力發展學院111年4月25日依據教育部111年4月27日臺教人(一)字第1110042416號書函轉行政院人事行政總處公務人力發展學院111年4月25日人人發綜字第1110300415號函辦理。
1608,11608,轉知：行政院辦理性平小學堂有獎徵答活動(0614更新),生輔組,生輔幹事,2022-05-03 08:04:52,6月30日7月4日7月5日
1609,11609,國立高雄科技大學 配合教育部111年高教深耕計畫 辦理111年四創種子師資培育課程【創四力】,教務處,陳韻萍,2022-05-03 08:43:44,
1610,11610,臺北市立百齡高級中學 英文領域專業社群為辦理「學習歷程檔案全攻略—教授就想看這些」研習  ,教務處,陳韻萍,2022-05-03 08:51:25,
1611,11611,轉知：臺北市政府教育局「臺北市高中以下學校財經素養探究任務實施計畫」，詳附件。,活動組,活動幹事,2022-05-03 08:54:33,
1612,11612,111年度高級中等學校專業群科專任教師赴公民營機構研習或研究暑假梯次報名相關事宜,教務處,陳韻萍,2022-05-03 08:55:59,
1613,11613,[高一]高一選班群講座流程及相關注意事項,教務處,註冊組長,2022-05-03 10:16:35,壹、日期：111 年5 月6 日(星期五)(1410-1500)貳、地點：線上https://ahsnccu.webex.com/ahsnccu-tc/j.php?MTID=m4e96c8576699c29a3e723bd87d062380參、與會班級：101-105學生肆、說明會流程:1400-1415 點名、開場1415-1430課程說明介紹各班群開課內容1430-1440選班群作業流程說明1440-1455性向測驗、興趣測驗1455-1500座談Q&A 
1614,11614,教育部修正「香港澳門居民來臺就學辦法」部分條文,教務處,註冊組幹事,2022-05-03 10:31:14,教育部修正「香港澳門居民來臺就學辦法」部分條文教育部修正「香港澳門居民來臺就學辦法」部分條文教育部修正「香港澳門居民來臺就學辦法」部分條文詳細請見附件詳細請見附件詳細請見附件
1615,11615,臺北市110學年度國民中學技藝教育課程技藝競賽成績得獎名單,輔導室,輔導幹事,2022-05-03 10:45:06,臺北市110學年度國民中學技藝教育課程技藝競賽成績臺北市110學年度國民中學技藝教育課程技藝競賽成績---賀------賀------賀---電機與電子群   電氣裝配(室內配線)     第一名  ---    九年四班   林O澔電機與電子群   電氣裝配(室內配線)     第一名  ---    九年四班   林O澔電機與電子群   網路資安               第二名  ---    九年三班   李 O電機與電子群   網路資安               第二名  ---    九年三班   李 O機械群         機械基礎工作-車床      第二名  ---    九年一班   陳O綸    機械群         機械基礎工作-車床      第二名  ---    九年一班   陳O綸    
1616,11616,防疫假學生退餐注意事項,衛生組,衛生組組長,2022-05-03 13:30:36,
1617,11617,政大附中「線上語文常識挑戰賽×國七」活動（5/4~5/6）,圖書館,圖書閱讀教師,2022-05-03 17:52:59,國立政治大學附屬高級中學110學年度第二學期「線上語文常識挑戰賽×國七」辦法110 一、活動宗旨：一、活動宗旨：（一） 為拓展數位學習的趣味性，引導學生透過網路自主學習。（一）  為拓展數位學習的趣味性，引導學生透過網路自主學習。（二） 為引導學生透過練習達到精熟，結合遊戲與競賽，使記憶性知識藉由遊戲加深印象。（二）  為引導學生透過練習達到精熟，結合遊戲與競賽，使記憶性知識藉由遊戲加深印象。二、主辦單位：國立政治大學附屬高級中學圖書館二、主辦單位：國立政治大學附屬高級中學圖書館三、實施方式：三、實施方式：（一） （一）                       學生自備載具（平板、電腦或智慧型手機），點選連結https://wordwall.net/play/31445/628/649學生自備載具（平板、電腦或智慧型手機），點選連結https://wordwall.net/play/31445/628/649https://wordwall.net/play/31445/628/649（二） 競賽題目範圍為：翰林版第二冊語文常識二。（二）  競賽題目範圍為：翰林版第二冊語文常識二。四、實施對象：國七各班學生自由參加。四、實施對象：國七各班學生自由參加。五、活動時間：2022年5月4日公告發布起至2022年5月6日22:00止。五、活動時間：2022年5月4日公告發布起至2022年5月6日22:00止。20225420225622:00六、競賽規則： 六、競賽規則： （一） 輸入完整且正確的班級姓名，方得參賽。例：706王小明。若輸入資料有誤，不計入成績。（一） 輸入完整且正確的班級姓名，方得參賽。例：706王小明。若輸入資料有誤，不計入成績。   輸入完整且正確的班級姓名，方得參賽。例：706王小明。若輸入資料有誤，不計入成績。輸入完整且正確的班級姓名，方得參賽。例：706706王小明。若輸入資料有誤，不計入成績。            （二） 每次參賽計時1分鐘，每人不限參賽次數，取最高分。（二）  每次參賽計時1分鐘，每人不限參賽次數，取最高分。1七、獎勵辦法：七、獎勵辦法：（一） 年級最高分，發放圖書禮券100元。（一）  年級最高分，發放圖書禮券100元。100（二） 年級2～5名，發放文具小禮物乙份。（二）  年級2～5名，發放文具小禮物乙份。25（三） 以不重複領獎為原則。（三）  以不重複領獎為原則。
1618,11618,轉知-檢送「公立學校教職員退休資遣撫卹條例」第21條第1項規定之解釋令1份,人事室,人事助理,2022-05-04 07:51:22,一、依教育部111年4月29日臺教人(四)字第1114201437B號函辦理。一、依教育部111年4月29日臺教人(四)字第1114201437B號函辦理。二、查公立學校教職員退休資遣撫卹條例（以下簡稱退撫條例）第21條第1項規定，校長、教師、專業技術人員、二、查公立學校教職員退休資遣撫卹條例（以下簡稱退撫條例）第21條第1項規定，校長、教師、專業技術人員、    專業及技術教師、專任運動教練依第18條第1項第1款與第2款及第19條規定辦理自願退休生效日期，原則以2月    專業及技術教師、專任運動教練依第18條第1項第1款與第2款及第19條規定辦理自願退休生效日期，原則以2月     1日或8月1日為準。     1日或8月1日為準。三、次查有關公立學校退休教職員或遺族所領月退休金、月撫卹金（年撫卹金）或遺屬年金（月撫慰金）給付金額，三、次查有關公立學校退休教職員或遺族所領月退休金、月撫卹金（年撫卹金）或遺屬年金（月撫慰金）給付金額，    業經行政院、考試院111年4月7日院授人給字第11140005814號、考臺組貳二字第11100024601號公告自111年7月    業經行政院、考試院111年4月7日院授人給字第11140005814號、考臺組貳二字第11100024601號公告自111年7月     1日調高2%在案（本部111年4月21日臺教人(四)字第1110036441號函諒達）。是以，本次調整方案生效日以前     1日調高2%在案（本部111年4月21日臺教人(四)字第1110036441號函諒達）。是以，本次調整方案生效日以前    （即111年6月30日【含當日】以前）經權責機關審（核）定支領月退休金（含展期、減額月退休金及月補償金）    （即111年6月30日【含當日】以前）經權責機關審（核）定支領月退休金（含展期、減額月退休金及月補償金）     者，相關給付金額自111年7月1日起調高2%。     者，相關給付金額自111年7月1日起調高2%。四、教育部配合前開調整方案之實施日期，於兼顧教職員退休權益及學生受教權，爰發布旨揭解釋令。四、教育部配合前開調整方案之實施日期，於兼顧教職員退休權益及學生受教權，爰發布旨揭解釋令。
1619,11619,教育部辦理「111年全國語文競賽─閩南語朗讀文章」徵稿活動一案，自111年5月1日起至111年6月30日止，請參閱。,教務處,實研幹事,2022-05-04 08:42:33,主旨：教育部辦理「111年全國語文競賽─閩南語朗讀文章」徵稿活動一案，自111年5月1日起至111年6月30日止，請詳閱說明及附件。說明：一、為符合全國語文競賽實施要點之競賽宗旨，加強推行語文教育，教育部委請國立臺中教育大學辦理旨揭徵稿活 動，請鼓勵所屬人員踴躍投稿，       尤以撰寫適合國中小學生朗讀之文章為佳。重要資訊如下：      (一)徵稿時間：111年5月1日起至111年6月30日止。      (二)錄取通知時間：111年10月1日前（以電子郵件或簡訊通知）。      (三)收件方式：一律採電子郵寄，請寄至活動專屬信箱：koksailongthok@gmail.com。如有相關問題請洽活動專線04-2218-3815。      (四)注意事項：為提高初審效益，投件時，請投稿者先依文章內容逕自評估為適合學生朗讀或成人朗讀，於文章首行及檔名註明為：「學生朗讀組」或「成人朗讀組」。      (五)徵選作品一經採錄，每篇稿費為新臺幣900元。相關規定及細節，請至活動網站(http://www.ntcu.edu.tw/taiwanese/koksailongthok/)查詢。
1620,11620,<公告> 110學年度 母親節系列活動,訓育組,訓育組長,2022-05-04 09:24:02,<110學年度母親節系列活動>歡迎全校同學踴躍參加。日期：即日起至5月13日〈星期五〉活動項目及內容請見附檔。日期：即日起至5月13日〈星期五〉活動項目及內容請見附檔。
1621,11621,轉知：臺北市政府體育局辦理「111年臺北市週末田徑測驗賽(3)」競賽規程，詳附件。,活動組,活動幹事,2022-05-04 09:38:22,
1622,11622,轉知：國立政治大學法律學系系學會舉辦第二十七屆「政大法律全國高中生法律研習營」活動，詳附件。,活動組,活動幹事,2022-05-04 09:45:34,
1623,11623,轉知：財團法人勵馨社會福利事業基金會辦理「第20屆Formosa女兒獎甄選活動」海報，詳附件。,活動組,活動幹事,2022-05-04 09:56:16,
1624,11624,普通型高級中等學校生物學科中心 110學年度全國教師增能研習：基因改造科技與食農系統 實施計畫 ,教務處,陳韻萍,2022-05-04 14:11:16,
1625,11625,臺北市政府教育局 函轉國防部暫緩辦理111年4-6月全民國防教育營區參訪活動,教務處,陳韻萍,2022-05-04 14:13:37,
1626,11626,臺北市戶外與海洋教育子計畫三海洋教育活動  更改為「線上授課」,教務處,陳韻萍,2022-05-04 14:15:58,
1627,11627,110學年度第3次臺北市健康與護理跨校社群共備研習  調整為線上課程,教務處,陳韻萍,2022-05-04 14:20:25,
1628,11628,「110學年度健康與護理表現評量設計與學習成果檔案規劃暨校本課程地圖研習-加場」,教務處,陳韻萍,2022-05-04 14:22:22,
1629,11629,「密涅瓦國際高中課程Minerva Baccalaureate (MBacc課程)」研習活動 線上研習,教務處,陳韻萍,2022-05-04 14:24:43,
1630,11630,全民國防教育學科中心「111年全民國防教育線上增能研習專題講座」實施計畫 線上研習,教務處,陳韻萍,2022-05-04 14:45:30,
1631,11631,亞洲大學 辦理線上「跨X越－臺灣工藝研討會」改為線上會議,教務處,陳韻萍,2022-05-04 14:59:56,
1632,11632,臺北市政府教育局辦理「111年一般/專業種子師資增能回訓營」（中區場次） ,教務處,陳韻萍,2022-05-04 15:06:44,
1633,11633,轉知-檢送「公職人員利衝迴避法案例」彙編手冊」1份，請依說明下載辦理,人事室,人事助理,2022-05-04 15:27:00,一、依據教育部111年5月3日臺教政(一)字第1110042803號函轉法務部廉政署111年4月22日廉利字第11105001960號函辦理。一、依據教育部111年5月3日臺教政(一)字第1110042803號函轉法務部廉政署111年4月22日廉利字第11105001960號函辦理。二、為協助公職人員瞭解公職人員利益衝突迴避法（下稱本法）規範，防範因不諳本法規定而陷入違法之情事，法務部廉政署二、為協助公職人員瞭解公職人員利益衝突迴避法（下稱本法）規範，防範因不諳本法規定而陷入違法之情事，法務部廉政署    編製旨揭手冊，請各機關妥善運用旨揭手冊提供予適用對象，並利用適當時機宣導相關法令及函釋規定。    編製旨揭手冊，請各機關妥善運用旨揭手冊提供予適用對象，並利用適當時機宣導相關法令及函釋規定。三、旨揭「公職人員利衝迴避法案例彙編手冊(電子檔)」請至教育部公文附件下載區(https://attach.moe.gov.tw)，三、旨揭「公職人員利衝迴避法案例彙編手冊(電子檔)」請至教育部公文附件下載區(https://attach.moe.gov.tw)，    以文號：1110042803及認證碼：C3189F857D下載附件檔案。    以文號：1110042803及認證碼：C3189F857D下載附件檔案。
1634,11634,[高三升學]有關111學年度大學申請入學招生「第二階段考生審查資料上傳相關注意事項,教務處,註冊組長,2022-05-04 15:14:56,(一)除大學校系另有規定外，通過第一階段篩選之考生，應於111年5月5日起至各校系規定繳交截止日前上傳二階段備審資料。111年5月5日起至各校系規定繳交截止日前上傳(二)並依各校系規定向該大學完成報名、繳費等相關作業。電洽甄選委員會：(05)2721799(四)考生於上傳期間如發現學習歷程資料庫提供之第五學期修課紀錄、第五至第六學期課程學習成果及多元表現等檔案資料與當初上傳不相符，應儘速向註冊組反映。第五學期修課紀錄第五至第六學期課程學習成果及多元表現(五)如考生因疫情影響有確診、居家隔離、自主健康管理等情形，請盡速參閱該校系校網或聯繫報考校系，確定相關防疫指引。
1635,11635,化學學科中心辦理「化學科教師素養試題增能研習-素養試題的內涵、命題指引與試題改寫」研習,教務處,陳韻萍,2022-05-04 15:12:25,
1636,11636,國立宜蘭大學「2022年微觀大學」推廣教育非學分班課程資訊,輔導室,輔導幹事,2022-05-04 16:15:54,
1637,11637,有關鼓勵下載使用「臺灣社交距離APP」其措施等相關功能，詳如說明，請查照。,衛生組,學創-衛生,2022-05-04 19:55:31,
1638,11638,函轉行政院環境保護署與教育部共同辦理「111年環境知識競賽」，請貴校鼓勵所屬師生踴躍報名參加，詳如說明，請查照。,衛生組,學創-衛生,2022-05-04 20:27:55,
