,nid,title,department,staff,time,text
490,10490,轉知-臺北市111年度國中候用校長甄選「觀察實習」階段 評分規準,人事室,人事助理,2022-02-11 08:00:20,一、依據111年1月24日臺北市111年度市立國民中學候用校長 甄選儲訓委員會第2次會議決議辦理。一、依據111年1月24日臺北市111年度市立國民中學候用校長 甄選儲訓委員會第2次會議決議辦理。二、111年度市立國民中學候用校長甄選錄取名額為6名。二、111年度市立國民中學候用校長甄選錄取名額為6名。三、本次觀察實習規劃如下：三、本次觀察實習規劃如下：  (一)實習時間：111年3月14日（星期一）至111年6月17日（星期五）。  (一)實習時間：111年3月14日（星期一）至111年6月17日（星期五）。  (二)實習機制：應考人每人至2校實習，每週至少2日，每校實習時間為6週， 共計24日。  (二)實習機制：應考人每人至2校實習，每週至少2日，每校實習時間為6週， 共計24日。實習機制：應考人每人至2校實習，每週至少2日，每校實習時間為6週， 共計24日。實習機制：應考人每人至2校實習，每週至少2日，每校實習時間為6週， 共計24日。  (三)實習評分委員：2校師傅校長、2位分區視導督學及2組訪評小組（由1位教授及1位聘任督學）組成。  (三)實習評分委員：2校師傅校長、2位分區視導督學及2組訪評小組（由1位教授及1位聘任督學）組成。四、本次國中候用校長甄選「觀察實習」階段評分規準、甄選儲訓須知及其相關表件得至臺北市政府教育局國中候用校長報名網頁（網址：https://ppjhs.tp.edu.tw/ppjhs108/SSO）下載。四、本次國中候用校長甄選「觀察實習」階段評分規準、甄選儲訓須知及其相關表件得至臺北市政府教育局國中候用校長報名網頁（網址：https://ppjhs.tp.edu.tw/ppjhs108/SSO）下載。
491,10491,110學年度第2學期臺北市政府教育局「數位學生證服務整合入口網」簡訊服務,生輔組,生輔幹事,2022-02-11 08:12:40,110學年度第2學期，臺北市政府教育局「數位學生證服務整合入口網」簡訊服務家長意願調查表，請至學務處生輔組領取或自行下載如有意願訂閱此簡訊服務，請於111年2月25日(五)111111年2年2月25日(五)月25日(五)放學前完成下列步驟1.填妥意願調查表後至總務處出納組繳費總務處出納組2.再將回條(須有繳費核章)繳回學務處生輔組以完成系統作業學務處生輔組數位學生證服務整合入口網網址：https://ecard.tp.edu.tw/ecard/
493,10493,[獎助學金]國立政大附中110學年度第2學期大智慧獎學金申請開始(2/14-3/14),教務處,註冊組幹事,2022-02-11 08:21:44,一、申請對象：在本校就學之高中生(高一下、高二及高三學生)及國中生(七年級下、八年級及九年級學生)，每學期總成績為班級前15名，日常生活表現良好，並經本校班級導師推薦者。()()15二、獎助名額：依申請人表現擇優錄取    (一)高中部：每學期3名，每名獎助學金5000元，獎狀乙紙。)35000    (二)國中部：每學期3名，每名獎助學金3000元，獎狀乙紙。)33000三、申請時間：每學期開學註冊後一個月內(本學期時間：111/02/14-03/14)每學期開學註冊後一個月內(本學期時間：111/02/14-03/14)每學期開學註冊後一個月內(本學期時間：111/02/14-03/14)，向教務處註冊組提出申請，曾領取本獎助學金者，不得重複申請。惟本校國中部直升高中部學生至多可跨部各領取一次獎助學金。※1.其他請詳閱附件，申請繳件請繳交 紙本文件 與 電子檔 申請繳件請繳交 紙本文件 與 電子檔 申請繳件請繳交 紙本文件 與 電子檔 紙本文件 與 電子檔 (註冊組信箱：221@ahs.nccu.edu.tw)兩種。※2.國中部依規定不得公布排名，故國中部不需填寫排名。
494,10494,[獎助學金]國立政大附中110學年度第2學期人文進步獎助學金申請開始(2/14-3/14),教務處,註冊組幹事,2022-02-11 08:51:25,一、申請對象：在本校就學之高中生(高一下、高二及高三學生)及國中生 (國一下、國二及國三學生)，前學期每次段考成績全校排名之名次均有進步者（第二次定評排名優於第一次定評且第三次定評排名優於第二次定評一、申請對象：在本校就學之高中生(高一下、高二及高三學生)及國中生 (國一下、國二及國三學生)，前學期每次段考成績全校排名之名次均有進步者（第二次定評排名優於第一次定評且第三次定評排名優於第二次定評()()）。）。  ※高中部同學可上網自行查看各次段考成績及校排；國中部同學校排部分免填。※高中部※高中部同學可上網自行查看各次段考成績及校排；國中部同學校排部分免填。二、獎助名額    (一)高中部各年級2名：每名獎助學金3000元，獎狀乙紙。)23000    (二)國中部各年級2名：每名獎助學金2000元，獎狀乙紙。)22000三、申請時間：每學期開學註冊後一個月內(每學期開學註冊後一個月內(每學期開學註冊後一個月內(本學期時間：111/02/14-03/14)，向教務處註冊組提出申請。))其他詳情請參閱附件。
495,10495,[獎助學金]國立政大附中110學年度第2學期優秀清寒獎助學金申請開始(2/14-3/14),教務處,註冊組幹事,2022-02-11 08:56:13,一、申請對象：在本校就學之高中生(高一下、高二及高三學生)及國中生(七年級下、八年級及九年級學生)，前學期成績為班級前5名，日常生活表現良好，且經本校班級導師推薦者。()()5二、獎助名額    (一)高中部：每學期2名，每名獎助學金3000元，獎狀乙紙。)23000    (二)國中部：每學期2名，每名獎助學金2000元，獎狀乙紙。)22000三、申請時間：每學期開學註冊後一個月內(本學期時間：111/02/14-03/14)，向教務處註冊組提出申請。每學期開學註冊後一個月內(本學期時間：111/02/14-03/14)每學期開學註冊後一個月內(本學期時間：111/02/14-03/14)其他詳情請參閱其他詳情請參閱附件。※國中部依規定不得公布排名，故國中部不需填寫排名。
496,10496,[高三升學]轉知中興大學111學年度運動績優學生招生資訊,教務處,註冊組幹事,2022-02-11 09:04:53,中興大學111學年度運動績優學生招生資訊中興大學111學年度運動績優學生招生資訊說明：說明：一、中興大學為鼓勵運動專長學生升讀頂尖大學，特舉辦運動績優生單獨招生。111學年度招生運動項目有游泳、羽球、網球、桌球、排球、籃球、田徑、足球等。報名資訊如下：一、中興大學為鼓勵運動專長學生升讀頂尖大學，特舉辦運動績優生單獨招生。111學年度招生運動項目有游泳、羽球、網球、桌球、排球、籃球、田徑、足球等。報名資訊如下：(一)報名日期：111年3月2日起至3月14日止，採網路報名、上傳審查資料。(一)報名日期：111年3月2日起至3月14日止，採網路報名、上傳審查資料。(二)術科考試日期：111年3月25日。(二)術科考試日期：111年3月25日。(三)報名網址為：http://recruit.nchu.edu.tw/。招生簡章開放下載。(三)報名網址為：http://recruit.nchu.edu.tw/。招生簡章開放下載。二、檢附該項招生考試資訊(如附件)供參閱，其他相關事項請詳見招生簡章。二、檢附該項招生考試資訊(如附件)供參閱，其他相關事項請詳見招生簡章。
497,10497,[高三升學]轉知臺東大學111學年度原住民專班招生資訊,教務處,註冊組幹事,2022-02-11 09:10:32,臺東大學111學年度原住民專班招生資訊臺東大學111學年度原住民專班招生資訊說明：說明：一、臺東大學111學年度原住民專班招生訂於111年2月18日（星期五）上午9時起至111年4月25日（星期一）下午4時止受理網路報名。一、臺東大學111學年度原住民專班招生訂於111年2月18日（星期五）上午9時起至111年4月25日（星期一）下午4時止受理網路報名。二、招生日程及名額等相關資訊請詳見招生簡章。招生簡章請至該校招生專區網頁下載，網址：https://enro.nttu.edu.tw/。二、招生日程及名額等相關資訊請詳見招生簡章。招生簡章請至該校招生專區網頁下載，網址：https://enro.nttu.edu.tw/。三、招生諮詢服務請洽該校教務處綜合業務組，連絡電話(089)318855轉分機1132洪小姐。三、招生諮詢服務請洽該校教務處綜合業務組，連絡電話(089)318855轉分機1132洪小姐。
498,10498,法務部設計之公民教案,教務處,陳韻萍,2022-02-11 09:28:27,
499,10499,110學年度教師增能研習暨跨單位策略聯盟「探究式課程發展：校園螞蟻採集與鑑定」,教務處,陳韻萍,2022-02-11 09:34:57,
500,10500,「110學年度跨高等教育單位合作-影像與配樂解析(線上)研習」,教務處,陳韻萍,2022-02-11 09:40:40,
501,10501,教育人員各項法定研習一覽,生輔組,生輔組組長,2022-02-11 14:28:29,教育人員每年參加相關研習（含進修活動）之時數規定如下：環境教育研習性別平等教育學校衛生相關研習兒童權利公約研習家庭教育研習急救教育研習資安教育訓練輔導知能研習特教研習註：依據「高級中等以下學校身心障礙學生就讀普通班減少班級人數或提供人力資源與協助辦法」第 5 條第 2 項規定:「前項班級導師，有優先參加特殊教育相關研習權利與義務」。為提升本市班級導師特教知能，110學年度各校(園)班上有特殊教育學生之普通班導師，上學期尚未依學生障礙類別參加研習者，請至教育 部-特殊教育數位課程平臺參加研習註：依據「高級中等以下學校身心障礙學生就讀普通班減少班級人數或提供人力資源與協助辦法」第 5 條第 2 項規定:「前項班級導師，有優先參加特殊教育相關研習權利與義務」。為提升本市班級導師特教知能，110學年度各校(園)班上有特殊教育學生之普通班導師，上學期尚未依學生障礙類別參加研習者，請至教育 部-特殊教育數位課程平臺參加研習110()-。
502,10502,[國三升學]轉知新北市金山高中111學年度原住民族藝能班單獨招生簡章,教務處,註冊組幹事,2022-02-11 14:43:22,新北市金山高中111學年度原住民族藝能班單獨招生簡章新北市金山高中111學年度原住民族藝能班單獨招生簡章說明：說明：一、旨揭簡章可至該校官網首頁(https://www.cshs.ntpc.edu.tw)高中招生資訊下載使用，重要事項摘錄如下：一、旨揭簡章可至該校官網首頁(https://www.cshs.ntpc.edu.tw)高中招生資訊下載使用，重要事項摘錄如下：(一)報名日期：111年3月14日(星期一)起至111年3月25日(星期五)止。(一)報名日期：111年3月14日(星期一)起至111年3月25日(星期五)止。(二)報名作業(二)報名作業應屆畢業生一律由就讀國中學校代為辦理集體報名。應屆畢業生一律由就讀國中學校代為辦理集體報名。非應屆畢業生請自行掛號郵寄報名。非應屆畢業生請自行掛號郵寄報名。請於報名截止前將報名資料正本，以掛號郵寄該校教務處註冊組收(以郵戳為憑)。請於報名截止前將報名資料正本，以掛號郵寄該校教務處註冊組收(以郵戳為憑)。(三)報名費：免費。(三)報名費：免費。(四)錄取公告：111年4月8日(星期五)上午9時前。(四)錄取公告：111年4月8日(星期五)上午9時前。(五)錄取報到：111年4月11日(星期一)下午1時至4時。(五)錄取報到：111年4月11日(星期一)下午1時至4時。(七)其他相關規定請詳閱招生簡章。(七)其他相關規定請詳閱招生簡章。(七)其他相關規定請詳閱招生簡章。(七)其他相關規定請詳閱招生簡章。
503,10503,轉知：財團法人金車文教基金會「愛讓世界轉動 兒少公益行動」第11屆徵選簡章訊息，詳附件。,活動組,活動幹事,2022-02-11 15:07:04,
504,10504,檢送中國青年救國團台北市團務指導委員會辦理「慶祝111年青年節臺北市表揚中等學校優秀青年實施辦法」乙份,訓育組,訓育幹事,2022-02-11 16:52:28,
505,10505,轉知-醒吾科技大學111學年度碩士班招生訊息,人事室,人事助理,2022-02-14 07:33:17,一、招生系所：資訊科技應用系碩士班(含在職專班)、行銷與流通管理系碩士班(含在職專班)及觀光休閒系碩士班。一、招生系所：資訊科技應用系碩士班(含在職專班)、行銷與流通管理系碩士班(含在職專班)及觀光休閒系碩士班。二、報名期間：111年3月7日(一)起至4月26日(二)止。二、報名期間：111年3月7日(一)起至4月26日(二)止。三、複(面)試日期：111年5月14日(六)三、複(面)試日期：111年5月14日(六)四、本項招生免筆試、一律採網路填表、通訊或現場繳件，招生簡章公告於本校招生網頁，四、本項招生免筆試、一律採網路填表、通訊或現場繳件，招生簡章公告於本校招生網頁，    免費下載網址：https://b001.hwu.edu.tw/Post?PId=66949    免費下載網址：https://b001.hwu.edu.tw/Post?PId=66949
506,10506,歷史學科中心「高三加深加廣選修 科技與社會專題」,教務處,陳韻萍,2022-02-14 07:51:40,
507,10507,國立清華大學竹師教育學院「性/別教育發展中心」辦理「111年性別平等優良教學方案甄選活動」,教務處,陳韻萍,2022-02-14 07:59:04,
508,10508,轉知行政院農業委員會編定「犬隻飼養與照顧指南」業公開發布於該會動物保護資訊網，請善用該網站資源並協助宣導週知,衛生組,學創-衛生,2022-02-14 08:39:52,
509,10509,轉知中華數學協會「2022 Math Kangaroo Taiwan，袋鼠數學比賽」,教務處,設備幹事,2022-02-14 08:52:23,
510,10510,110學年度第二學期校內特教鑑定工作開始，請有需求者依時程辦理,輔導室,特教幹事,2022-02-14 09:43:53,1.國中特教鑑定校內轉介時程：即日起至111年2月18日(五)。高中特教鑑定校內轉介時程：即日起至111年2月25日(五)。1.國中特教鑑定校內轉介時程：即日起至111年2月18日(五)。高中特教鑑定校內轉介時程：即日起至111年2月25日(五)。2.家長如欲幫孩子提送特教鑑定，請先向導師確認孩子在校狀況(如有相關醫療資料可一併提出)，待導師完成轉介資料後進入鑑定流程。2.家長如欲幫孩子提送特教鑑定，請先向導師確認孩子在校狀況(如有相關醫療資料可一併提出)，待導師完成轉介資料後進入鑑定流程。3.導師請依校內轉介流程進行(另發通知說明)。3.導師請依校內轉介流程進行(另發通知說明)。4.承辦人員：輔導室特教黃老師(#9511)。4.承辦人員：輔導室特教黃老師(#9511)。
511,10511,大學招生委員會聯合會辦理「大學選才與高中育才輔助系統計畫」,輔導室,輔導幹事,2022-02-14 10:10:30,
512,10512,110學年度第二學期第2次兼任鐘點特教助理員甄選,輔導室,特教幹事,2022-02-14 10:34:43,一、類別名稱:兼任鐘點特教助理員，1名。一、類別名稱:兼任鐘點特教助理員，1名。二、聘期:111年2月21日起至111年6月30日止。二、聘期:111年2月21日起至111年6月30日止。三、報名時間:即日起至111年2月18日(五)中午12:00止三、報名時間:即日起至111年2月18日(五)中午12:00止四、報名地點:本校輔導室四、報名地點:本校輔導室五、其餘詳見附件110年第二學期第2次兼任鐘點特教助理員甄選簡章。五、其餘詳見附件110年第二學期第2次兼任鐘點特教助理員甄選簡章。
513,10513,中國文化大學辦理「就要融化你！台北最暖靠山 中國文化大學2022 CCU校園博覽會」,輔導室,輔導幹事,2022-02-14 11:39:24,
514,10514,[國三升學]轉知臺北市立啟聰學校111學年度普通型及技術型高中招生簡章,教務處,註冊組幹事,2022-02-14 14:48:56,臺北市立啟聰學校111學年度普通型及技術型高中招生簡章臺北市立啟聰學校111學年度普通型及技術型高中招生簡章詳細說明請見附件詳細說明請見附件
515,10515,[獎助學金]黃昆輝教授基金會111年寶佳高中學生獎學金,教務處,註冊組幹事,2022-02-14 15:29:20,黃昆輝教授基金會111年寶佳高中學生獎學金黃昆輝教授基金會111年寶佳高中學生獎學金說明：說明：一、獎助條件：同時具備以下二項條件一、獎助條件：同時具備以下二項條件1.持有政府核發低收(中低收)入戶、弱勢兒童及少年生活扶助證明文件者。1.持有政府核發低收(中低收)入戶、弱勢兒童及少年生活扶助證明文件者。2.持有相關機構核發之失親(雙親；父或母亡故)；隔代教養(含親屬代養)、身心障礙(雙親；父或母)、單親(父母離異)或家庭變故(父母因故無法履行扶養責任或家庭遭受特殊變故等)的有效證明文件、戶籍謄本等證明者。2.持有相關機構核發之失親(雙親；父或母亡故)；隔代教養(含親屬代養)、身心障礙(雙親；父或母)、單親(父母離異)或家庭變故(父母因故無法履行扶養責任或家庭遭受特殊變故等)的有效證明文件、戶籍謄本等證明者。二、申請時間；二、申請時間；110年3月16日中午12:30前備妥相關文件、申請書(附件)送至教務處註冊組110年3月16日中午12:30前備妥相關文件、申請書(附件)送至教務處註冊組110年3月16日中午12:30前三、詳細獎學金要點及申請書請見附件。三、詳細獎學金要點及申請書請見附件。
516,10516,[獎助學金]轉知新竹縣110學年度第2學期清寒優秀學生獎學金資訊,教務處,註冊組幹事,2022-02-14 17:21:32,轉知新竹縣110學年度第2學期清寒優秀學生獎學金資訊轉知新竹縣110學年度第2學期清寒優秀學生獎學金資訊說明：說明：一、申請資格：凡設籍新竹縣六個月以上，在國內公私立中等以上學校就讀之家境清寒學生，且未享有公費或其他獎助學金者。一、申請資格：凡設籍新竹縣六個月以上，在國內公私立中等以上學校就讀之家境清寒學生，且未享有公費或其他獎助學金者。二、申請時間：即日起至3月4日為止，備妥相關文件送至教務處註冊組。二、申請時間：即日起至3月4日為止，備妥相關文件送至教務處註冊組。詳細相關規定請詳閱附件詳細相關規定請詳閱附件
517,10517,轉知-國立彰化師範大學進修學院推廣教育課程招生簡章共5門課程,人事室,人事助理,2022-02-15 07:34:41,"一、國立彰化師範大學進修學院推廣教育課程：一、國立彰化師範大學進修學院推廣教育課程： (一)「心靈綻放之旅-粉彩曼陀羅藝術療癒工作坊」課程時間為111年4月10日(日) 上午9:00-16:00，合計6小時， (一)「心靈綻放之旅-粉彩曼陀羅藝術療癒工作坊」課程時間為111年4月10日(日) 上午9:00-16:00，合計6小時，       公務人員及教師可登錄研習時數，課程費用為每人3,200元(含材料，贈一組粉彩)，3/10前報名享優惠價2,880元。       公務人員及教師可登錄研習時數，課程費用為每人3,200元(含材料，贈一組粉彩)，3/10前報名享優惠價2,880元。 (二)「旅繪日記：生活輕水彩-英國篇」課程時間為111年4月17、24日至5月1、15日(周日)13:00-16:00，合計4堂共12小時， (二)「旅繪日記：生活輕水彩-英國篇」課程時間為111年4月17、24日至5月1、15日(周日)13:00-16:00，合計4堂共12小時，       課程費用每人4,500元(含共用牛頓水彩，贈A5速寫本1本、明信片水彩卡5張)，3/20前報名或雙人同行享優惠價3,600元。       課程費用每人4,500元(含共用牛頓水彩，贈A5速寫本1本、明信片水彩卡5張)，3/20前報名或雙人同行享優惠價3,600元。 (三)「旅繪日記：生活輕水彩-法國篇」課程時間為111年5月22、29日至6月12、19日(周日)13:00-16:00，合計4堂共12小時， (三)「旅繪日記：生活輕水彩-法國篇」課程時間為111年5月22、29日至6月12、19日(周日)13:00-16:00，合計4堂共12小時，       公務人員及教師可登錄研習時數，課程費用每人4,500元(含共用牛頓水彩，贈A5速寫本1本、明信片水彩卡5張)，       公務人員及教師可登錄研習時數，課程費用每人4,500元(含共用牛頓水彩，贈A5速寫本1本、明信片水彩卡5張)，       4/22前報名或雙人同行享優惠價每人3,600元。       4/22前報名或雙人同行享優惠價每人3,600元。 (四)「酒精墨水流動畫-多元藝術創作工作坊」課程時間為111年5月1日(周日)14:00~16:30，合計2.5小時，公務人員及教師 (四)「酒精墨水流動畫-多元藝術創作工作坊」課程時間為111年5月1日(周日)14:00~16:30，合計2.5小時，公務人員及教師       可登錄研習時數，課程費用每人2,400元(含材料費、加碼贈送A5及A6畫框)，4/10前報名享優惠價每人1,900元。       可登錄研習時數，課程費用每人2,400元(含材料費、加碼贈送A5及A6畫框)，4/10前報名享優惠價每人1,900元。 (五)「裂紋水泥盆器創作應用班」課程時間為111年5月28日(周六)10:00~15:00，合計4小時，公務人員及教師可登錄研習時數， (五)「裂紋水泥盆器創作應用班」課程時間為111年5月28日(周六)10:00~15:00，合計4小時，公務人員及教師可登錄研習時數，       課程費用每人1,889元(含材料費)，4/10前報名享優惠價每人1,700元。       課程費用每人1,889元(含材料費)，4/10前報名享優惠價每人1,700元。二、報名步驟：線上報名，請至國立彰化師範大學進修學院報名管理系統報名。如第一次報名，請先申請帳號。(https://aps.ncue.edu.tw/cee/index.php)二、報名步驟：線上報名，請至國立彰化師範大學進修學院報名管理系統報名。如第一次報名，請先申請帳號。(https://aps.ncue.edu.tw/cee/index.php)三、報名規定及其他課程資訊請詳閱各課程招生簡章，如有相關問題，請逕向簡章中聯絡人洽詢。三、報名規定及其他課程資訊請詳閱各課程招生簡章，如有相關問題，請逕向簡章中聯絡人洽詢。"
518,10518,轉知-國家圖書館與台北歌德學院合辦「圖書館和綠能發展願景」專題演講,人事室,人事助理,2022-02-15 07:40:52,一、旨揭專題演講訂於本（111）年3月4日下午3:00-5:00，於本館藝文中心三樓國際會議廳舉行。講者為德國柏林一、旨揭專題演講訂於本（111）年3月4日下午3:00-5:00，於本館藝文中心三樓國際會議廳舉行。講者為德國柏林    邦潘克夫市海因利希波爾圖書館館長提姆舒曼（Tim Schumann）先生，其將針對全球永續發展，探討圖書館推動    邦潘克夫市海因利希波爾圖書館館長提姆舒曼（Tim Schumann）先生，其將針對全球永續發展，探討圖書館推動    綠能發展及所應扮演之積極角色，並分享該館的相關經驗。    綠能發展及所應扮演之積極角色，並分享該館的相關經驗。二、本演講以德語進行，全程由專業譯者張君德先生進行中德文雙向口譯。二、本演講以德語進行，全程由專業譯者張君德先生進行中德文雙向口譯。三、全程參與者將核予公務人員或教師終身學習時數2小時認證；請於國家圖書館活動報名網頁(https://reurl.cc/zMqxnV)，進行線上報名。三、全程參與者將核予公務人員或教師終身學習時數2小時認證；請於國家圖書館活動報名網頁(https://reurl.cc/zMqxnV)，進行線上報名。
519,10519,為因應本市嚴重特殊傳染性肺炎（COVID-19，簡稱新冠肺炎）疫情警戒微解封，請貴校(園)自111年2月15日(星期二)起依說明辦理相關事宜,衛生組,學創-衛生,2022-02-15 08:51:49,
520,10520,「2022年國際資訊奧林匹亞競賽」選手初選,圖書館,資訊工程師,2022-02-15 09:48:08,
521,10521,海外僑教老師及海外青年文化志工錄製之城市文化或節慶特色英文介紹影片宣傳,圖書館,資訊工程師,2022-02-15 10:34:40,
522,10522,檢送內政部訂定發布「外國專業人才及其配偶子女申請永久居留無不良素行認定標準」，請參閱。,教務處,實研幹事,2022-02-15 13:43:08,主旨：檢送內政部訂定發布「外國專業人才及其配偶子女申請永久居留無不良素行認定標準」，請詳閱附件。
